question,author
Sending List of Enum over RestTemplate,o
npm ERR! keccak@1.4.0 rebuild: `node-gyp rebuild`,u
Trying to build my old Nativescript app (ios),a
fill an array line by line in a loop,r
reading a large (>50MB) pivot table from Excel with openpyxl,O
React loader showing on page load only similar to Pace - react typescript / react-router,o
R: how to add rows in dataframe by manipulating a datetime column,L
How to send a SOAP WebRequest with parameters and get Response?,o
How do I add Vuetify 3 to Laravel 8 Jetsteam + inertia,e
Is there any solution that this computer recognize the list but not as a integer?,.
